Articule,Likes,Price,Link
Sac à bandoulière Gris Zara,4,,https://percentil.fr/vetements-seconde-main/sac-a-bandouliere-gris-zara-13010774
Sac à bandoulière Noir Desigual,7,,https://percentil.fr/vetements-seconde-main/sac-a-bandouliere-noir-desigual-13010638
Sac à bandoulière Noir BIMBA Y LOLA,5,,https://percentil.fr/vetements-seconde-main/sac-a-bandouliere-noir-bimba-y-lola-13010628
Sac à bandoulière Imprimé BIMBA Y LOLA,8,,https://percentil.fr/vetements-seconde-main/sac-a-bandouliere-imprime-bimba-y-lola-13010624
Sac à bandoulière Gris Victoria Couture,23,26.45€,https://percentil.fr/vetements-seconde-main/sac-a-bandouliere-gris-victoria-couture-12632566
Sac à bandoulière Marron Uterqüe,8,,https://percentil.fr/vetements-seconde-main/sac-a-bandouliere-marron-uterque-13007352
Sac à main  Imprimé PERCENTIL,5,,https://percentil.fr/vetements-seconde-main/sac-a-main-imprime-percentil-13007074
Sac à bandoulière Noir PERCENTIL,4,,https://percentil.fr/vetements-seconde-main/sac-a-bandouliere-noir-percentil-13006982
Sac à bandoulière Imprimé Blame Eugenia,0,,https://percentil.fr/vetements-seconde-main/sac-a-bandouliere-imprime-blame-eugenia-13005708
Sac à main  Gris BIMBA Y LOLA,0,,https://percentil.fr/vetements-seconde-main/sac-a-main-gris-bimba-y-lola-13005704
Sac cabas Marron Hello Kitty,0,,https://percentil.fr/vetements-seconde-main/sac-cabas-marron-hello-kitty-13005698
Sac à main  Rouge Tommy Hilfiger,2,,https://percentil.fr/vetements-seconde-main/sac-a-main-rouge-tommy-hilfiger-13005644
Sac à bandoulière Marron Giovanna,7,43.95€,https://percentil.fr/vetements-seconde-main/sac-a-bandouliere-marron-giovanna-12964778
Mini sac Animal print Zara,5,7.95€,https://percentil.fr/vetements-seconde-main/mini-sac-animal-print-zara-12962236
Sac cabas Noir Disney,7,18.95€,https://percentil.fr/vetements-seconde-main/sac-cabas-noir-disney-12922864
Sac à bandoulière Violet  PERCENTIL,3,,https://percentil.fr/vetements-seconde-main/sac-a-bandouliere-violet-percentil-12916232
Sac à main  Doré H&M,0,,https://percentil.fr/vetements-seconde-main/sac-a-main-dore-h-m-12995794
Sac à bandoulière Violet  Skunkfunk,7,,https://percentil.fr/vetements-seconde-main/sac-a-bandouliere-violet-skunkfunk-12994958
Sac à main  Rayé PERCENTIL,2,,https://percentil.fr/vetements-seconde-main/sac-a-main-raye-percentil-12994618
Sac cabas Marron PERCENTIL,4,8.95€,https://percentil.fr/vetements-seconde-main/sac-cabas-marron-percentil-12975988
